{
  "$schema": "../schemas/character.schema.json",
  "schemaVersion": 1,
  "id": "resident-12",
  "slug": "mina-lark",
  "releaseState": "active",
  "contentVersion": 1,
  "capabilities": { "resident": true, "storyActor": false, "playable": false },
  "identity": { "name": { "en": "Mina Lark" }, "role": { "en": "first-year student" } },
  "world": { "home": "great hall", "startingActivity": "wandering", "startingGoal": "complete tonight's duties", "startingMood": "calm" },
  "presentation": { "archetype": "student", "appearance": { "cloak": "#493744", "height": 0.84, "hood": "round", "accessory": "tiny-satchel" }, "movement": { "style": "skip", "speed": 1.26, "cadence": 7.6, "bob": 0.075 }, "weapon": { "name": "lark practice wand", "damage": 0.5 } },
  "production": { "migrationSource": ["data/sky-characters.json"] }
}
