{
  "$schema": "../schemas/character.schema.json",
  "schemaVersion": 1,
  "id": "resident-16",
  "slug": "vera-loom",
  "releaseState": "active",
  "contentVersion": 1,
  "capabilities": { "resident": true, "storyActor": false, "playable": false },
  "identity": { "name": { "en": "Vera Loom" }, "role": { "en": "student" } },
  "world": { "home": "great hall", "startingActivity": "wandering", "startingGoal": "complete tonight's duties", "startingMood": "calm" },
  "presentation": { "archetype": "student", "appearance": { "cloak": "#4a304a", "accent": "#d19bc7", "accessory": "thread-charms" }, "movement": { "style": "sway", "sway": 0.09, "speed": 1.02 }, "weapon": { "type": "wand", "name": "loom threadwand", "color": "#ef9fda" } },
  "production": { "migrationSource": ["data/sky-characters.json"] }
}
