{
  "$schema": "../schemas/character.schema.json",
  "schemaVersion": 1,
  "id": "resident-05",
  "slug": "corin-ash",
  "releaseState": "active",
  "contentVersion": 2,
  "capabilities": { "resident": true, "storyActor": false, "playable": false },
  "identity": { "name": { "en": "Corin Ash" }, "role": { "en": "junior warden" } },
  "world": { "home": "rune court", "startingActivity": "wandering", "startingGoal": "complete tonight's duties", "startingMood": "calm" },
  "presentation": { "archetype": "warden", "appearance": { "cloak": "#27313c", "height": 0.98, "accessory": "single-pauldron" }, "movement": { "style": "eager-march", "speed": 1.34 }, "weapon": { "type": "wand", "name": "ash baton", "color": "#efb77f", "damage": 1.1 } },
  "production": { "migrationSource": ["data/sky-characters.json", "js/sky-room/characters/manifest.js"] }
}
